{
  "schema_version": "1.2.2",
  "iss": "drkhaleej-service-identity",
  "sub": "entity-worker-1",
  "aud": ["automation-control-plane"],
  "scopes": ["job:execute"],
  "iat": 1784102400,
  "nbf": 1784102400,
  "exp": 1784102700,
  "jti": "88888888-8888-4888-8888-888888888888",
  "body_sha256": "aaaaaaaaaaaaaaaaaaaaaaaaaaaaaaaaaaaaaaaaaaaaaaaaaaaaaaaaaaaaaaaa",
  "job_id": "77777777-7777-4777-8777-777777777777",
  "lease_epoch": 1
}
